video_title,video_duration,date_released_utc,view_count,like_count,comment_count,date_collected_utc
Extra CRISPY Suya Spice Tofu - No Frying!,PT3M39S,2024-08-18 16:34:12+00:00,53,10,1,2024-08-21 23:28:34.652835+00:00
High Protein Lentil Bolognese | My New Kitchen + Naked Wines!,PT6M55S,2024-08-11 16:53:52+00:00,73,13,1,2024-08-21 23:28:35.553427+00:00
1-Ingredient Black Bean Flatbread | Gluten Free Recipe,PT2M7S,2024-08-04 16:30:00+00:00,2182,126,8,2024-08-21 23:28:36.523719+00:00
Incredible Chocolate Chip Cookies in 10 Mins | vegan + easy recipe,PT2M30S,2024-07-28 21:00:24+00:00,113,7,0,2024-08-21 23:28:37.566177+00:00
"1 Minute Coffee Cake with Whipped Cream | Soft, Eggless, Dairy-Free Recipe",PT3M9S,2024-07-21 16:30:07+00:00,274,23,3,2024-08-21 23:28:39.501182+00:00
"Dreamy Coconut Cake | No Egg, No Butter, One Bowl",PT2M26S,2024-07-14 16:30:02+00:00,3812,49,3,2024-08-21 23:28:41.492854+00:00
The Best Vegan BANANA CAKE Recipe,PT3M18S,2024-07-07 11:00:14+00:00,290,20,2,2024-08-21 23:28:42.696763+00:00
"Vegan Biscoff Cheesecake - No Oven, No Tofu, No Nuts | PLUS how to fix split cheesecake batter",PT5M6S,2024-06-30 16:30:03+00:00,361,21,0,2024-08-21 23:28:44.319886+00:00
Cabin Biscuit Cheesecake | Easy Baked Vegan Cheesecake,PT3M15S,2024-06-23 16:30:00+00:00,88,8,4,2024-08-21 23:28:45.583652+00:00
This Chocolate Sauce (or Dip) Has A Secret Ingredient,PT3M14S,2024-06-16 16:30:06+00:00,74,8,1,2024-08-21 23:28:46.878605+00:00
How To Make Welsh Cakes  - Egg Free & Dairy Free,PT2M39S,2024-06-09 17:30:02+00:00,84,8,2,2024-08-21 23:28:48.169336+00:00
I Attended A Vegan Fine Dining Event,PT3M6S,2024-06-02 18:30:05+00:00,71,13,1,2024-08-21 23:28:50.702234+00:00
Beans And Plantain Waffles - no talking; a bit of ASMR cooking,PT5M5S,2024-05-19 16:30:10+00:00,83,10,7,2024-08-21 23:28:52.634461+00:00
"Zero Waste Lasagna | Non Traditional, Vegan, Enough To Feed An Army",PT3M43S,2024-05-12 17:00:15+00:00,255,16,0,2024-08-21 23:28:53.565188+00:00
Smoky Jollof Rice - I'll Show You How In Under 3 Minutes,PT2M39S,2024-05-05 17:00:04+00:00,558,33,6,2024-08-21 23:28:55.080821+00:00
No Bake Carrot Cake With Cashew Cream Frosting,PT5M24S,2024-04-28 17:50:08+00:00,190,17,3,2024-08-21 23:28:56.115134+00:00
Vegan Smash Cake For My Baby's First Birthday,PT7M20S,2024-04-21 16:26:59+00:00,280,14,5,2024-08-21 23:28:56.860740+00:00
Chinese Takeaway Curry Sauce | Quick and Easy Recipe,PT6M44S,2024-04-07 16:00:19+00:00,147,7,0,2024-08-21 23:28:58.710293+00:00
Top 5 Nigerian Snacks You Must Try,PT6M14S,2024-03-24 17:00:32+00:00,216,19,2,2024-08-21 23:29:00.547516+00:00
Making The Viral Fruity Chocolate Bites,PT3M44S,2024-03-17 17:00:12+00:00,531,19,3,2024-08-21 23:29:02.525410+00:00
Got Some Dates? Make This!,PT3M42S,2024-03-10 17:00:28+00:00,138,14,1,2024-08-21 23:29:03.804801+00:00
My Husband Makes ZOBO (Hibiscus Punch) | Vegan Nigerian Drink,PT1M52S,2024-03-03 17:00:19+00:00,131,19,2,2024-08-21 23:29:04.490395+00:00
Homemade Hobnobs  - Crunchy Oat Biscuits,PT3M3S,2024-02-25 17:00:14+00:00,360,20,0,2024-08-21 23:29:06.721248+00:00
My Vegan Nigerian Wedding,PT13M17S,2024-02-18 17:00:22+00:00,1545,82,15,2024-08-21 23:29:07.627227+00:00
Don't Make These Cheesy Sweet Potato Pancakes,PT3M6S,2024-02-11 17:00:32+00:00,105,7,2,2024-08-21 23:29:09.164087+00:00
Turn Rich Tea Biscuits Into A Cake With Only 3 Ingredients,PT3M16S,2024-02-04 17:00:02+00:00,507,12,6,2024-08-21 23:29:10.442827+00:00
The Best Vegan Madeleines  - Achieve The Signature Bump,PT2M54S,2024-01-28 17:00:36+00:00,201,12,5,2024-08-21 23:29:11.808925+00:00
Nigerian Buns Recipe  - Egg Free & Dairy Free,PT2M29S,2024-01-21 17:00:47+00:00,784,27,0,2024-08-21 23:29:13.116884+00:00
Extra CRISPY Suya Spice Tofu - No Frying!,PT3M39S,2024-08-18 16:34:12+00:00,56,10,4,2024-08-24 07:51:53.077662+00:00
High Protein Lentil Bolognese | My New Kitchen + Naked Wines!,PT6M55S,2024-08-11 16:53:52+00:00,75,13,1,2024-08-24 07:51:53.498891+00:00
1-Ingredient Black Bean Flatbread | Gluten Free Recipe,PT2M7S,2024-08-04 16:30:00+00:00,2180,127,8,2024-08-24 07:51:53.913015+00:00
Incredible Chocolate Chip Cookies in 10 Mins | vegan + easy recipe,PT2M30S,2024-07-28 21:00:24+00:00,113,7,0,2024-08-24 07:51:54.317718+00:00
"1 Minute Coffee Cake with Whipped Cream | Soft, Eggless, Dairy-Free Recipe",PT3M9S,2024-07-21 16:30:07+00:00,278,23,3,2024-08-24 07:51:54.795988+00:00
"Dreamy Coconut Cake | No Egg, No Butter, One Bowl",PT2M26S,2024-07-14 16:30:02+00:00,3818,49,3,2024-08-24 07:51:55.258191+00:00
The Best Vegan BANANA CAKE Recipe,PT3M18S,2024-07-07 11:00:14+00:00,295,20,2,2024-08-24 07:51:55.676382+00:00
"Vegan Biscoff Cheesecake - No Oven, No Tofu, No Nuts | PLUS how to fix split cheesecake batter",PT5M6S,2024-06-30 16:30:03+00:00,363,21,0,2024-08-24 07:51:56.127650+00:00
Cabin Biscuit Cheesecake | Easy Baked Vegan Cheesecake,PT3M15S,2024-06-23 16:30:00+00:00,88,8,4,2024-08-24 07:51:56.557918+00:00
This Chocolate Sauce (or Dip) Has A Secret Ingredient,PT3M14S,2024-06-16 16:30:06+00:00,76,8,1,2024-08-24 07:51:56.977026+00:00
How To Make Welsh Cakes  - Egg Free & Dairy Free,PT2M39S,2024-06-09 17:30:02+00:00,85,8,2,2024-08-24 07:51:57.402137+00:00
I Attended A Vegan Fine Dining Event,PT3M6S,2024-06-02 18:30:05+00:00,71,13,1,2024-08-24 07:51:57.838900+00:00
Beans And Plantain Waffles - no talking; a bit of ASMR cooking,PT5M5S,2024-05-19 16:30:10+00:00,83,10,7,2024-08-24 07:51:58.249011+00:00
"Zero Waste Lasagna | Non Traditional, Vegan, Enough To Feed An Army",PT3M43S,2024-05-12 17:00:15+00:00,256,17,0,2024-08-24 07:51:58.704662+00:00
Smoky Jollof Rice - I'll Show You How In Under 3 Minutes,PT2M39S,2024-05-05 17:00:04+00:00,569,33,6,2024-08-24 07:51:59.169575+00:00
No Bake Carrot Cake With Cashew Cream Frosting,PT5M24S,2024-04-28 17:50:08+00:00,190,17,3,2024-08-24 07:51:59.610627+00:00
Vegan Smash Cake For My Baby's First Birthday,PT7M20S,2024-04-21 16:26:59+00:00,286,14,5,2024-08-24 07:52:00.003867+00:00
Chinese Takeaway Curry Sauce | Quick and Easy Recipe,PT6M44S,2024-04-07 16:00:19+00:00,163,7,0,2024-08-24 07:52:00.426404+00:00
Top 5 Nigerian Snacks You Must Try,PT6M14S,2024-03-24 17:00:32+00:00,218,19,2,2024-08-24 07:52:00.837834+00:00
Making The Viral Fruity Chocolate Bites,PT3M44S,2024-03-17 17:00:12+00:00,531,19,3,2024-08-24 07:52:01.260828+00:00
Got Some Dates? Make This!,PT3M42S,2024-03-10 17:00:28+00:00,138,14,1,2024-08-24 07:52:01.680582+00:00
My Husband Makes ZOBO (Hibiscus Punch) | Vegan Nigerian Drink,PT1M52S,2024-03-03 17:00:19+00:00,131,19,2,2024-08-24 07:52:02.089844+00:00
Homemade Hobnobs  - Crunchy Oat Biscuits,PT3M3S,2024-02-25 17:00:14+00:00,361,20,0,2024-08-24 07:52:02.540195+00:00
My Vegan Nigerian Wedding,PT13M17S,2024-02-18 17:00:22+00:00,1545,82,15,2024-08-24 07:52:02.937156+00:00
Don't Make These Cheesy Sweet Potato Pancakes,PT3M6S,2024-02-11 17:00:32+00:00,105,7,2,2024-08-24 07:52:03.368716+00:00
Turn Rich Tea Biscuits Into A Cake With Only 3 Ingredients,PT3M16S,2024-02-04 17:00:02+00:00,512,12,6,2024-08-24 07:52:03.800633+00:00
The Best Vegan Madeleines  - Achieve The Signature Bump,PT2M54S,2024-01-28 17:00:36+00:00,201,12,5,2024-08-24 07:52:04.290813+00:00
Nigerian Buns Recipe  - Egg Free & Dairy Free,PT2M29S,2024-01-21 17:00:47+00:00,790,28,0,2024-08-24 07:52:04.708733+00:00
Is This The Best Vegan Whipped Cream? - Elmlea Plant Cream Review,PT3M25S,2024-01-14 17:00:43+00:00,1012,24,5,2024-08-24 07:52:05.087211+00:00
This Silky Corn Porridge Is Great For Your Gut - Ogi | Akamu | Pap,PT2M42S,2024-01-07 18:00:14+00:00,192,13,3,2024-08-24 07:52:05.509513+00:00
4 Creative Puff Puff Recipes || West African Vegan Snack,PT28M16S,2022-08-27 09:21:43+00:00,477,35,3,2024-08-24 07:52:05.896467+00:00
Dublan | Nigerian Hausa Snack,PT59S,2022-08-22 16:29:58+00:00,508,25,0,2024-08-24 07:52:06.321641+00:00
3 Ingredient Oreo Cake | Viral TikTok Recipe with NO OVEN,PT3M11S,2022-07-05 14:52:23+00:00,752,41,6,2024-08-24 07:52:06.773092+00:00
Vegan NKWOBI or ISI EWU using VChunks! Does it work???,PT5M2S,2021-09-26 15:00:11+00:00,576,37,3,2024-08-24 07:52:07.170670+00:00
Reduce High Blood Pressure With A Vegan Diet | Sherra Aguirre Interview,PT26M53S,2021-07-19 21:30:12+00:00,1828,67,5,2024-08-24 07:52:07.593013+00:00
"How Tracye McQuirter Helped 15,000 Black Women Go Vegan",PT24M,2021-06-28 15:09:50+00:00,932,61,14,2024-08-24 07:52:08.038605+00:00
4 Ingredient PLANTAIN WAFFLES | Easy Vegan Recipe,PT2M15S,2021-06-14 14:30:48+00:00,746,56,6,2024-08-24 07:52:08.539721+00:00
Best Vegan Food For Gut Health And How To Reduce Bloating,PT25M37S,2021-05-31 19:00:10+00:00,237,20,2,2024-08-24 07:52:08.934797+00:00
Vegan Flake Chocolate Bar | How to Make Flake / Twirl Chocolate | Attempt #1,PT4M23S,2021-05-23 08:16:00+00:00,1808,49,6,2024-08-24 07:52:09.360842+00:00
Baking Moin Moin Like A Cake | Easy Vegan + Gluten Free Recipe,PT3M7S,2021-05-18 15:30:16+00:00,703,34,5,2024-08-24 07:52:09.727651+00:00
Being Vegan Helps Me Grow & Be A Better Person | The Vegan Foode,PT20M55S,2021-05-10 15:00:03+00:00,173,16,1,2024-08-24 07:52:10.149490+00:00
"Vegan Nigerian ""Egg"" Stew | Oil Free & Healthy",PT3M30S,2021-05-03 17:12:10+00:00,730,56,10,2024-08-24 07:52:10.578366+00:00
"I Made Vegan ""Chicken"" from Scratch | Easy Seitan Recipe",PT4M1S,2021-04-19 16:30:15+00:00,6090,253,99,2024-08-24 07:52:10.977698+00:00
Frejon (Coconut Bean Soup) | Nigerian Easter Recipe | IG Live,PT15M39S,2021-04-04 15:00:01+00:00,431,10,2,2024-08-24 07:52:11.415879+00:00
Vegan Edible Dish Sponge Cake | April Fool's Prank | Easy Illusion Cake,PT4M31S,2021-03-28 15:00:18+00:00,301,31,5,2024-08-24 07:52:11.854941+00:00
Cheesy GARLIC PLANTAIN Bread | Easy VEGAN Recipe,PT6M28S,2021-03-13 10:30:16+00:00,549,56,14,2024-08-24 07:52:12.273001+00:00
Prosecco & Pink Lemonade Cake | Vegan 4 Layer Celebration Cake,PT8M36S,2021-03-03 20:36:30+00:00,224,32,5,2024-08-24 07:52:12.679202+00:00
Savoury Rice & Cassava Pancakes | Oil Free + Vegan | Pancake Day,PT7M28S,2021-02-14 16:15:05+00:00,309,21,2,2024-08-24 07:52:13.156558+00:00
2 Oil Free + Vegan Red Stews,PT8M18S,2021-01-30 12:15:04+00:00,904,88,11,2024-08-24 07:52:13.562507+00:00
"What I Eat In A Day | Oil Free, Healthy Vegan Recipes",PT5M59S,2021-01-24 12:15:06+00:00,642,51,17,2024-08-24 07:52:13.981105+00:00
Vegan Grocery Haul -  Fresh Produce,PT5M,2021-01-17 10:00:11+00:00,265,29,3,2024-08-24 07:52:14.406257+00:00
"Chewy Chocolate Banana Cookies | Vegan, Gluten Free, Oil Free",PT3M23S,2021-01-10 16:48:28+00:00,321,30,4,2024-08-24 07:52:14.788940+00:00
3 Festive Side Dishes | Easy Vegan Recipes,PT10M9S,2020-12-21 13:00:11+00:00,278,21,3,2024-08-24 07:52:15.190585+00:00
Mulled Wine Recipe with Hibiscus and Ginger! | Delicious Christmas Drink,PT4M45S,2020-12-19 15:34:20+00:00,315,17,0,2024-08-24 07:52:15.588147+00:00
Traditional Nigerian Snacks (Vegan) | I Created A Course on Udemy!,PT2M2S,2020-11-28 10:00:18+00:00,476,38,4,2024-08-24 07:52:15.969323+00:00
Do You Know Your Risk for Type 2 Diabetes?,PT5M1S,2020-10-30 16:00:26+00:00,241,20,0,2024-08-24 07:52:16.445410+00:00
Spiced Apple Raspberry Crumble | Bake and Relax #withme,PT2M18S,2020-10-25 13:17:32+00:00,221,30,9,2024-08-24 07:52:16.872564+00:00
Vegan Nigerian Fish Stew | Obe Eja Recipe,PT3M8S,2020-10-17 13:57:47+00:00,736,53,21,2024-08-24 07:52:17.293647+00:00
Yam Porridge | Asaro Recipe | The Vegan Nigerian,PT2M50S,2020-10-04 18:00:44+00:00,951,65,7,2024-08-24 07:52:17.751273+00:00
Vegan Egg Fried Rice | Easy Vegan Recipe,PT2M3S,2020-09-11 13:54:31+00:00,905,51,18,2024-08-24 07:52:18.207447+00:00
